{
  "model_id": "reference-tiny-llm",
  "backend": "gateway",
  "gpu_memory_mib": {
    "min": 0,
    "max": 0
  },
  "supports_mig": false,
  "supports_quantization": false,
  "cold_start_seconds": {
    "min": 0,
    "max": 5
  },
  "cpu_dev_mode": true,
  "notes": "Routing gateway (phase-13). Selects among catalogued backends using recorded benchmark/results latency and bedrock-gateway/pricing-reference.json cost/latency. No local GPU. See ADR-006."
}
