{
  "model_id": "reference-tiny-llm",
  "backend": "serving/common",
  "gpu_memory_mib": {
    "min": 0,
    "max": 0
  },
  "supports_mig": false,
  "supports_quantization": true,
  "cold_start_seconds": {
    "min": 1,
    "max": 5
  },
  "cpu_dev_mode": true,
  "notes": "CPU-only reference package for local compose and CI. Never select GPU nodes for this artifact."
}
