{
  "model_id": "reference-tiny-llm-lora-demo",
  "backend": "bentoml",
  "gpu_memory_mib": {
    "min": 0,
    "max": 0
  },
  "supports_mig": false,
  "supports_quantization": true,
  "cold_start_seconds": {
    "min": 5,
    "max": 90
  },
  "cpu_dev_mode": true,
  "notes": "Base reference-tiny-llm + PEFT LoRA adapter (ADR-011). Served through unchanged /v1/infer. Adapter weights are CI/local artifacts — structurally verified, never SHA256-pinned (ADR-009)."
}
