{
  "model_id": "reference-tiny-llm",
  "backend": "triton",
  "gpu_memory_mib": {
    "min": 0,
    "max": 0
  },
  "supports_mig": true,
  "supports_quantization": true,
  "cold_start_seconds": {
    "min": 15,
    "max": 120
  },
  "cpu_dev_mode": true,
  "notes": "CPU-dev Triton + contract shim. ONNX Runtime backend (KIND_CPU). MIG/TensorRT paths documented in README; not used in CI (ADR-002)."
}
